{
  "schema_version": 1,
  "dynasty": "秦",
  "tick": 2084,
  "year": 86,
  "stage": "chun-qiu",
  "stage_progress": 0.8573,
  "season": "冬",
  "weather": "晴",
  "treasury": {
    "wen-shu": 10023,
    "gong-ju": 6421,
    "qian-liang": 16885,
    "jian-zhu": 694,
    "hu-ji": 4169,
    "dian-ji": 1038,
    "yi-li": 4182,
    "bing-qi": 9363,
    "xue-wen": 6,
    "cheng-chi": 414
  },
  "provinces": {
    "python": {
      "level": 1,
      "loyalty": 200,
      "last_tick": 2084,
      "produced": 10392,
      "consumed": 0,
      "fail_streak": 0,
      "quarantined": false
    },
    "c": {
      "level": 1,
      "loyalty": 200,
      "last_tick": 2084,
      "produced": 7283,
      "consumed": 0,
      "fail_streak": 0,
      "quarantined": false
    },
    "sql": {
      "level": 1,
      "loyalty": 200,
      "last_tick": 2084,
      "produced": 4169,
      "consumed": 0,
      "fail_streak": 0,
      "quarantined": false
    },
    "bash": {
      "level": 1,
      "loyalty": 200,
      "last_tick": 2082,
      "produced": 694,
      "consumed": 5552,
      "fail_streak": 0,
      "quarantined": false
    },
    "brainfuck": {
      "level": 1,
      "loyalty": 200,
      "last_tick": 2083,
      "produced": 0,
      "consumed": 0,
      "fail_streak": 0,
      "quarantined": false
    },
    "prolog": {
      "level": 1,
      "loyalty": 200,
      "last_tick": 2084,
      "produced": 0,
      "consumed": 0,
      "fail_streak": 0,
      "quarantined": false
    },
    "jq": {
      "level": 1,
      "loyalty": 200,
      "last_tick": 2084,
      "produced": 1038,
      "consumed": 5190,
      "fail_streak": 0,
      "quarantined": false
    },
    "make": {
      "level": 1,
      "loyalty": 200,
      "last_tick": 2080,
      "produced": 414,
      "consumed": 11592,
      "fail_streak": 0,
      "quarantined": false
    },
    "go": {
      "level": 1,
      "loyalty": 200,
      "last_tick": 2084,
      "produced": 12343,
      "consumed": 0,
      "fail_streak": 0,
      "quarantined": false
    },
    "haskell": {
      "level": 1,
      "loyalty": 89,
      "last_tick": 14,
      "produced": 6,
      "consumed": 0,
      "fail_streak": 3,
      "quarantined": true
    },
    "html": {
      "level": 1,
      "loyalty": 200,
      "last_tick": 2084,
      "produced": 4150,
      "consumed": 0,
      "fail_streak": 0,
      "quarantined": false
    },
    "rust": {
      "level": 1,
      "loyalty": 200,
      "last_tick": 2084,
      "produced": 9363,
      "consumed": 0,
      "fail_streak": 0,
      "quarantined": false
    },
    "typescript": {
      "level": 1,
      "loyalty": 85,
      "last_tick": 12,
      "produced": 0,
      "consumed": 0,
      "fail_streak": 3,
      "quarantined": true
    },
    "whitespace": {
      "level": 1,
      "loyalty": 200,
      "last_tick": 2079,
      "produced": 0,
      "consumed": 0,
      "fail_streak": 0,
      "quarantined": false
    },
    "csv": {
      "level": 1,
      "loyalty": 200,
      "last_tick": 2084,
      "produced": 12822,
      "consumed": 0,
      "fail_streak": 0,
      "quarantined": false
    },
    "toml": {
      "level": 1,
      "loyalty": 200,
      "last_tick": 2084,
      "produced": 6903,
      "consumed": 0,
      "fail_streak": 0,
      "quarantined": false
    },
    "ini": {
      "level": 1,
      "loyalty": 200,
      "last_tick": 2084,
      "produced": 5920,
      "consumed": 0,
      "fail_streak": 0,
      "quarantined": false
    },
    "glsl": {
      "level": 1,
      "loyalty": 108,
      "last_tick": 1920,
      "produced": 32,
      "consumed": 0,
      "fail_streak": 0,
      "quarantined": false
    }
  },
  "events": [
    {
      "tick": 2084,
      "year": 86,
      "type": "produce",
      "from_province": "ini",
      "text": "节段郡按 INI 条目整备工坊器具 4 件。",
      "severity": "info",
      "artifact": null
    },
    {
      "tick": 2084,
      "year": 86,
      "type": "produce",
      "from_province": "toml",
      "text": "表头郡按 TOML 章表修成文书 3 卷。",
      "severity": "info",
      "artifact": null
    },
    {
      "tick": 2084,
      "year": 86,
      "type": "produce",
      "from_province": "rust",
      "text": "锈铁郡 冬日炼器，炉火映甲，献兵器 3 件。",
      "severity": "info",
      "artifact": null
    },
    {
      "tick": 2084,
      "year": 86,
      "type": "produce",
      "from_province": "python",
      "text": "白蛇郡 冬日抄录，天朗气清，献文书 4 卷。",
      "severity": "info",
      "artifact": null
    },
    {
      "tick": 2084,
      "year": 86,
      "type": "produce",
      "from_province": "html",
      "text": "文骨郡 冬蜡定节，献仪礼 2 章。",
      "severity": "info",
      "artifact": null
    },
    {
      "tick": 2084,
      "year": 86,
      "type": "produce",
      "from_province": "go",
      "text": "御行郡 冬储足备，驿道清明，献钱粮 8 石。",
      "severity": "info",
      "artifact": null
    },
    {
      "tick": 2084,
      "year": 86,
      "type": "produce",
      "from_province": "c",
      "text": "始源郡 冬日 鼓风炼铁，铸工具 2 件。",
      "severity": "info",
      "artifact": null
    },
    {
      "tick": 2084,
      "year": 86,
      "type": "transform",
      "from_province": "jq",
      "text": "角铲郡铲文书 5 卷，钞撮成典籍 1 编。",
      "severity": "info",
      "artifact": null
    },
    {
      "tick": 2084,
      "year": 86,
      "type": "service",
      "from_province": "prolog",
      "text": "律令郡今日无讼，律书一卷，束阁待召。",
      "severity": "info",
      "artifact": null
    },
    {
      "tick": 2084,
      "year": 86,
      "type": "service",
      "from_province": "csv",
      "text": "列点郡按 CSV 仓表盘点，入库钱粮 6 石。",
      "severity": "info",
      "artifact": null
    },
    {
      "tick": 2084,
      "year": 86,
      "type": "service",
      "from_province": "sql",
      "text": "簿录郡奉诏巡丁，新增 3 户，共 12 口。",
      "severity": "info",
      "artifact": null
    },
    {
      "tick": 2083,
      "year": 86,
      "type": "unlock",
      "from_province": "xml",
      "text": "帝国 86 年，齐人仕秦，献「XML」之术。帝国从此设「尖括郡」，列于官署之列。",
      "severity": "epic"
    },
    {
      "tick": 2083,
      "year": 86,
      "type": "unlock",
      "from_province": "toml",
      "text": "帝国 86 年，蜀人仕秦，献「TOML」之术。帝国从此设「表头郡」，列于工坊之列。",
      "severity": "epic"
    },
    {
      "tick": 2083,
      "year": 86,
      "type": "unlock",
      "from_province": "json",
      "text": "帝国 86 年，鲁人仕秦，献「JSON」之术。帝国从此设「度量郡」，列于官署之列。",
      "severity": "epic"
    },
    {
      "tick": 2083,
      "year": 86,
      "type": "unlock",
      "from_province": "ini",
      "text": "帝国 86 年，卫人仕秦，献「INI」之术。帝国从此设「节段郡」，列于工坊之列。",
      "severity": "epic"
    },
    {
      "tick": 2083,
      "year": 86,
      "type": "unlock",
      "from_province": "csv",
      "text": "帝国 86 年，宋人仕秦，献「CSV」之术。帝国从此设「列点郡」，列于官署之列。",
      "severity": "epic"
    },
    {
      "tick": 2083,
      "year": 86,
      "type": "ceremony",
      "from_province": "brainfuck",
      "text": "奇技郡焚奇香，街巷皆嗅，竟数日不散。",
      "severity": "info",
      "artifact": null
    },
    {
      "tick": 2083,
      "year": 86,
      "type": "produce",
      "from_province": "ini",
      "text": "节段郡按 INI 条目整备工坊器具 3 件。",
      "severity": "info",
      "artifact": null
    },
    {
      "tick": 2083,
      "year": 86,
      "type": "produce",
      "from_province": "toml",
      "text": "表头郡按 TOML 章表修成文书 3 卷。",
      "severity": "info",
      "artifact": null
    },
    {
      "tick": 2083,
      "year": 86,
      "type": "produce",
      "from_province": "rust",
      "text": "锈铁郡 冬日炼器，炉火映甲，献兵器 5 件。",
      "severity": "info",
      "artifact": null
    },
    {
      "tick": 2083,
      "year": 86,
      "type": "produce",
      "from_province": "python",
      "text": "白蛇郡 冬日抄录，天朗气清，献文书 3 卷。",
      "severity": "info",
      "artifact": null
    },
    {
      "tick": 2083,
      "year": 86,
      "type": "produce",
      "from_province": "html",
      "text": "文骨郡 冬蜡定节，献仪礼 2 章。",
      "severity": "info",
      "artifact": null
    },
    {
      "tick": 2083,
      "year": 86,
      "type": "produce",
      "from_province": "go",
      "text": "御行郡 冬储足备，驿道清明，献钱粮 4 石。",
      "severity": "info",
      "artifact": null
    },
    {
      "tick": 2083,
      "year": 86,
      "type": "produce",
      "from_province": "c",
      "text": "始源郡 冬日 鼓风炼铁，铸工具 3 件。",
      "severity": "info",
      "artifact": null
    },
    {
      "tick": 2083,
      "year": 86,
      "type": "service",
      "from_province": "prolog",
      "text": "律令郡今日无讼，律书一卷，束阁待召。",
      "severity": "info",
      "artifact": null
    },
    {
      "tick": 2083,
      "year": 86,
      "type": "service",
      "from_province": "csv",
      "text": "列点郡按 CSV 仓表盘点，入库钱粮 6 石。",
      "severity": "info",
      "artifact": null
    },
    {
      "tick": 2083,
      "year": 86,
      "type": "service",
      "from_province": "sql",
      "text": "簿录郡奉诏巡丁，新增 2 户，共 7 口。",
      "severity": "info",
      "artifact": null
    },
    {
      "tick": 2082,
      "year": 86,
      "type": "unlock",
      "from_province": "xml",
      "text": "帝国 86 年，齐人仕秦，献「XML」之术。帝国从此设「尖括郡」，列于官署之列。",
      "severity": "epic"
    },
    {
      "tick": 2082,
      "year": 86,
      "type": "unlock",
      "from_province": "toml",
      "text": "帝国 86 年，蜀人仕秦，献「TOML」之术。帝国从此设「表头郡」，列于工坊之列。",
      "severity": "epic"
    },
    {
      "tick": 2082,
      "year": 86,
      "type": "unlock",
      "from_province": "json",
      "text": "帝国 86 年，鲁人仕秦，献「JSON」之术。帝国从此设「度量郡」，列于官署之列。",
      "severity": "epic"
    },
    {
      "tick": 2082,
      "year": 86,
      "type": "unlock",
      "from_province": "ini",
      "text": "帝国 86 年，卫人仕秦，献「INI」之术。帝国从此设「节段郡」，列于工坊之列。",
      "severity": "epic"
    },
    {
      "tick": 2082,
      "year": 86,
      "type": "unlock",
      "from_province": "csv",
      "text": "帝国 86 年，宋人仕秦，献「CSV」之术。帝国从此设「列点郡」，列于官署之列。",
      "severity": "epic"
    },
    {
      "tick": 2082,
      "year": 86,
      "type": "ceremony",
      "from_province": "brainfuck",